{
  "id": "15",
  "number": 15,
  "name": "제15대 국회",
  "starts_on": "1996-05-30",
  "ends_on": "2000-05-30",
  "seats": 299,
  "elections": [
    {
      "kind": null,
      "date": "1996-04-11",
      "seats": 299,
      "election_id": "19960411"
    }
  ],
  "results": [
    {
      "party_name": "합계",
      "vote_share": null,
      "seats": 299,
      "proportional_seats": 46
    },
    {
      "party_name": "신한국당",
      "vote_share": 35.1,
      "seats": 139,
      "proportional_seats": 18
    },
    {
      "party_name": "새정치국민회의",
      "vote_share": 24.8,
      "seats": 79,
      "proportional_seats": 13
    },
    {
      "party_name": "자유민주연합",
      "vote_share": 16.4,
      "seats": 50,
      "proportional_seats": 9
    },
    {
      "party_name": "무소속",
      "vote_share": 12.4,
      "seats": 16,
      "proportional_seats": null
    },
    {
      "party_name": "통합민주당",
      "vote_share": 11.3,
      "seats": 15,
      "proportional_seats": 6
    }
  ],
  "source_urls": [
    "https://open.assembly.go.kr/portal/data/service/selectServicePage.do/OLFZV7001148O518934",
    "https://open.assembly.go.kr/portal/data/service/selectServicePage.do/O7FHUO000928X018370"
  ],
  "verified": false,
  "checked_at": "2026-10-22",
  "note": "국회 자료의 임기 행이 개원일과 맞지 않아 종료일은 제16대 개원 전날로 적음 results는 국회 자료의 정당별 선거결과 그대로임. 의석수가 지역구만 센 것인지 전국구·비례를 더한 것인지 대마다 다름"
}
